{
  "Subject": "A single person positioned at the center of the composition, using the separately supplied identity reference for facial identity and natural appearance. Do not derive personal physical characteristics from the composition reference.",
  "Clothing": "A structured charcoal blazer with defined lapels, a matte woven fabric texture, subtle natural folds, and a neutral inner garment.",
  "Pose": "Seated upright with the torso slightly angled toward camera-right, shoulders relaxed, and hands resting naturally near the lap.",
  "Setting": "A contemporary interior featuring neutral-toned walls, a minimal seating arrangement, and carefully spaced decorative elements.",
  "Camera Settings": "Medium portrait framing, eye-level camera perspective, approximately 50mm full-frame-equivalent focal length, moderate background separation, and sharp focus on the subject.",
  "Lighting": "Soft directional daylight entering from camera-left, gentle shadow transitions, neutral color temperature, and subtle ambient fill from the surrounding interior.",
  "Effects": "Natural optical rendering, restrained background softness, subtle tonal transitions, and no exaggerated digital effects.",
  "Background": "A softly rendered contemporary interior with muted colors, balanced visual weight, and architectural details positioned behind the subject.",
  "Details": "Realistic garment folds, natural interaction between fabric and posture, coherent perspective, physically plausible contact shadows, and accurate spatial relationships.",
  "Quality": "High-fidelity photorealism, natural material rendering, consistent lighting, coherent anatomy, realistic textures, precise optical behavior, and no text overlays or artificial visual artifacts."
}
